{
  "id": "anne-lopez",
  "name": "Anne E. Lopez",
  "office": "Attorney General of Hawaii",
  "office_type": "state_ag",
  "state": "HI",
  "party": "D",
  "committees": [],
  "stance": "Opposes federal preemption of state online-safety and AI laws and backs federal frontier-AI safety regulation.",
  "statements": [
    {
      "date": "2026-05-27",
      "arena": "federal",
      "kind": "quote",
      "text": "States need the ability to respond quickly to emerging online threats impacting minors, whether that involves social media platforms, exploitative algorithms, artificial intelligence tools, or other digital harms.",
      "target": null,
      "joint": null,
      "source": "https://governor.hawaii.gov/newsroom/2026-29-attorney-general-lopez-leads-coalition-opposing-kids-act-supports-stronger-online-protections-for-children/",
      "outlet": "Hawaii Governor's Office newsroom"
    },
    {
      "date": "2026-09-23",
      "arena": "federal",
      "kind": "urging",
      "text": "Signed the 26-AG letter urging Congress to immediately establish comprehensive federal regulation and safety protocols for frontier AI, including mandatory federal oversight of safety testing, and to prohibit preemption of state law.",
      "target": "Congressional leadership (Johnson, Thune, Jeffries, Schumer)",
      "joint": "ag-letter-congress-sept-2026",
      "source": "https://oag.ca.gov/system/files/attachments/press-docs/federal-ai-regulation-letter-2026.pdf",
      "outlet": "California Attorney General (letter PDF)"
    },
    {
      "date": "2025-11-25",
      "arena": "federal",
      "kind": "urging",
      "text": "Joined a 36-AG letter to Congress opposing federal legislation that would bar states from enacting or enforcing AI laws.",
      "target": "Congress",
      "joint": "naag-ai-preemption-letter-2025",
      "source": "https://www.ag.idaho.gov/newsroom/attorney-general-labrador-pushes-back-against-federal-overreach-on-states-regulation-of-artificial-intelligence/",
      "outlet": "Idaho Attorney General"
    }
  ],
  "review": {
    "status": "unreviewed",
    "note": "research pass, September 2026; not yet reviewed"
  }
}
